{
  "Version": 1,
  "Revision": "example-not-commissioned",
  "SiteId": "site-1",
  "Plcs": [
    {
      "Id": "fx5u-eight-temperature",
      "Model": "FX5U \u2014 replace with exact SKU",
      "Firmware": "unknown",
      "Host": "",
      "Port": 0,
      "Enabled": false,
      "FrameMode": "Binary",
      "PollMs": 1000,
      "TimeoutMs": 3000,
      "Sensors": [
        {
          "Id": "temperature-1",
          "Name": "temperature-1",
          "Address": "D100",
          "Type": "Int16",
          "SwapWords": false,
          "Scale": 0.1,
          "Offset": 0,
          "Unit": "degC",
          "Min": null,
          "Max": null
        },
        {
          "Id": "temperature-2",
          "Name": "temperature-2",
          "Address": "D101",
          "Type": "Int16",
          "SwapWords": false,
          "Scale": 0.1,
          "Offset": 0,
          "Unit": "degC",
          "Min": null,
          "Max": null
        },
        {
          "Id": "temperature-3",
          "Name": "temperature-3",
          "Address": "D102",
          "Type": "Int16",
          "SwapWords": false,
          "Scale": 0.1,
          "Offset": 0,
          "Unit": "degC",
          "Min": null,
          "Max": null
        },
        {
          "Id": "temperature-4",
          "Name": "temperature-4",
          "Address": "D103",
          "Type": "Int16",
          "SwapWords": false,
          "Scale": 0.1,
          "Offset": 0,
          "Unit": "degC",
          "Min": null,
          "Max": null
        },
        {
          "Id": "temperature-5",
          "Name": "temperature-5",
          "Address": "D104",
          "Type": "Int16",
          "SwapWords": false,
          "Scale": 0.1,
          "Offset": 0,
          "Unit": "degC",
          "Min": null,
          "Max": null
        },
        {
          "Id": "temperature-6",
          "Name": "temperature-6",
          "Address": "D105",
          "Type": "Int16",
          "SwapWords": false,
          "Scale": 0.1,
          "Offset": 0,
          "Unit": "degC",
          "Min": null,
          "Max": null
        },
        {
          "Id": "temperature-7",
          "Name": "temperature-7",
          "Address": "D106",
          "Type": "Int16",
          "SwapWords": false,
          "Scale": 0.1,
          "Offset": 0,
          "Unit": "degC",
          "Min": null,
          "Max": null
        },
        {
          "Id": "temperature-8",
          "Name": "temperature-8",
          "Address": "D107",
          "Type": "Int16",
          "SwapWords": false,
          "Scale": 0.1,
          "Offset": 0,
          "Unit": "degC",
          "Min": null,
          "Max": null
        }
      ]
    },
    {
      "Id": "fx5u-mixed",
      "Model": "FX5U \u2014 replace with exact SKU",
      "Firmware": "unknown",
      "Host": "",
      "Port": 0,
      "Enabled": false,
      "FrameMode": "Binary",
      "PollMs": 1000,
      "TimeoutMs": 3000,
      "Sensors": [
        {
          "Id": "pressure-1",
          "Name": "pressure-1",
          "Address": "D200",
          "Type": "Float32",
          "SwapWords": false,
          "Scale": 1,
          "Offset": 0,
          "Unit": "bar",
          "Min": null,
          "Max": null
        },
        {
          "Id": "pressure-2",
          "Name": "pressure-2",
          "Address": "D202",
          "Type": "Float32",
          "SwapWords": false,
          "Scale": 1,
          "Offset": 0,
          "Unit": "bar",
          "Min": null,
          "Max": null
        },
        {
          "Id": "gas-quality-1",
          "Name": "gas-quality-1",
          "Address": "D220",
          "Type": "Int16",
          "SwapWords": false,
          "Scale": 1,
          "Offset": 0,
          "Unit": "ppm",
          "Min": null,
          "Max": null
        },
        {
          "Id": "gas-quality-2",
          "Name": "gas-quality-2",
          "Address": "D221",
          "Type": "Int16",
          "SwapWords": false,
          "Scale": 1,
          "Offset": 0,
          "Unit": "ppm",
          "Min": null,
          "Max": null
        },
        {
          "Id": "gas-quality-3",
          "Name": "gas-quality-3",
          "Address": "D222",
          "Type": "Int16",
          "SwapWords": false,
          "Scale": 1,
          "Offset": 0,
          "Unit": "ppm",
          "Min": null,
          "Max": null
        },
        {
          "Id": "gas-quality-4",
          "Name": "gas-quality-4",
          "Address": "D223",
          "Type": "Int16",
          "SwapWords": false,
          "Scale": 1,
          "Offset": 0,
          "Unit": "ppm",
          "Min": null,
          "Max": null
        },
        {
          "Id": "temperature-1",
          "Name": "temperature-1",
          "Address": "D240",
          "Type": "Int16",
          "SwapWords": false,
          "Scale": 0.1,
          "Offset": 0,
          "Unit": "degC",
          "Min": null,
          "Max": null
        },
        {
          "Id": "temperature-2",
          "Name": "temperature-2",
          "Address": "D241",
          "Type": "Int16",
          "SwapWords": false,
          "Scale": 0.1,
          "Offset": 0,
          "Unit": "degC",
          "Min": null,
          "Max": null
        },
        {
          "Id": "temperature-3",
          "Name": "temperature-3",
          "Address": "D242",
          "Type": "Int16",
          "SwapWords": false,
          "Scale": 0.1,
          "Offset": 0,
          "Unit": "degC",
          "Min": null,
          "Max": null
        },
        {
          "Id": "temperature-4",
          "Name": "temperature-4",
          "Address": "D243",
          "Type": "Int16",
          "SwapWords": false,
          "Scale": 0.1,
          "Offset": 0,
          "Unit": "degC",
          "Min": null,
          "Max": null
        },
        {
          "Id": "temperature-5",
          "Name": "temperature-5",
          "Address": "D244",
          "Type": "Int16",
          "SwapWords": false,
          "Scale": 0.1,
          "Offset": 0,
          "Unit": "degC",
          "Min": null,
          "Max": null
        }
      ]
    }
  ],
  "CloudUrl": "",
  "RetentionDays": 30,
  "MaxBufferMb": 1024
}
